<?xml version="1.0" encoding="UTF-8"?>
<!DOCTYPE pr SYSTEM "PR.dtd">
<pr>
    <metadata>
        <keyname>TP9_MEI2019_DAW</keyname>
        <title>Trabalho Prático 9</title>
        <subtitle>Desenvolvimento de Aplicações Web</subtitle>
        <supervisor homepage="http://www4.di.uminho.pt/~jcr/">José Carlos Ramalho</supervisor>
        <bdate>11 de Novembro 2019</bdate>
        <edate>18 de Novembro 2019</edate>
    </metadata>
    <workteam>
        <member>
            <identifier>PG41070</identifier>
            <name>Diogo Filipe Gigante da Silva</name>
            <email>pg41070@alunos.uminho.pt</email>
            <git>https://github.com/diogogsilva/dweb2019</git>
        </member>
    </workteam>
    <abstract>
        <p>Trabalho Prático Número 9.<b>Desenvolvimento de Aplicações Web</b></p>
        <p>-> App em Node para automatizar o comando MongoImport</p>
        <p><i>By:</i><u><xref url="https://github.com/diogogsilva/dweb2019">Diogo Silva</xref></u></p>
    </abstract>
</pr>